{
  "apiVersion": "nexoharness.dev/v1alpha1",
  "kind": "Evaluation",
  "metadata": { "id": "scope-eval", "title": "Scope Evaluation", "version": "0.1.0", "status": "draft" },
  "spec": {
    "target": "Rule:scope-rule",
    "method": "behavioral",
    "passCriteria": ["Unrelated changes are escalated."],
    "evidenceClass": "E3"
  }
}
